<?xml version="1.0" encoding="UTF-8"?>
<!ELEMENT peliculas (pelicula*)>
<!ELEMENT pelicula (titulo, director, actor)>
<!ATTLIST pelicula id CDATA #REQUIRED>
<!ELEMENT titulo (#PCDATA)>
<!ELEMENT director (#PCDATA)>
<!ELEMENT actor (#PCDATA)>